{
  "code": "WA",
  "xrisk": "direct",
  "summary": "Washington's enacted AI laws are about companion chatbots and deepfakes (adjacent), but AG Nick Brown signed the September 2026 multistate letter warning of potentially existential risk and urging Congress to keep AI under human control.",
  "items": [
    {
      "date": "2026-03-24",
      "type": "law",
      "title": "HB 2225 — AI companion chatbots",
      "status": "signed",
      "text": "Requires AI disclosure, self-harm protocols and bans sexual content and manipulative engagement with minors; effective January 1, 2027.",
      "source": "https://www.hunton.com/privacy-and-cybersecurity-law-blog/washington-state-enacts-law-regulating-ai-companion-chatbots-with-private-right-of-action",
      "people": [
        "bob-ferguson"
      ]
    },
    {
      "date": "2026-09-24",
      "type": "letter",
      "title": "26-AG letter to Congress on frontier AI",
      "status": "filed",
      "text": "Brown joined AGs urging federal frontier-AI oversight, saying inaction risks potentially existential harm.",
      "source": "https://www.atg.wa.gov/news/news-releases/ag-brown-and-bipartisan-coalition-call-congress-protect-americans-unchecked-ai",
      "people": [
        "nick-brown"
      ]
    }
  ],
  "profile": {
    "headline": "Washington is studying data centers and AI more than it is regulating them: a big data center bill died in 2026, while three narrower AI laws passed.",
    "sections": [
      {
        "topic": "state_push",
        "text": "Gov. Bob Ferguson's Executive Order 25-05 (February 2025) created a Data Center Workgroup, which reported eight recommendations in December 2025. In March 2026 Ferguson signed three AI laws: HB 1170 (provenance or watermarking for AI-generated content), HB 2225 (companion chatbots, with protections for minors) and SSB 5886 (digital-likeness rights). A 19-member state AI task force released its final report in July 2026.",
        "sources": [
          {
            "url": "https://columbiainsight.org/wash-data-center-workgroup-wont-recommend-clean-energy-requirement/",
            "outlet": "Columbia Insight"
          },
          {
            "url": "https://www.glacis.io/guide-washington-state-ai",
            "outlet": "Glacis"
          },
          {
            "url": "https://www.geekwire.com/2026/as-washington-states-ai-task-force-winds-down-the-debate-over-how-much-to-regulate-is-far-from-settled/",
            "outlet": "GeekWire"
          }
        ]
      },
      {
        "topic": "compute",
        "text": "Quincy is the center of Washington's data center industry, with 53 facilities totalling about 1,073 MW; Microsoft runs 27 of them and Sabey 7. Data centers raised Quincy's assessed value to more than $6.1 billion in 2025 and pay 57% of its property tax. HB 2515, a comprehensive bill to regulate large data centers, passed the House 51-41 in 2026 but died in the Senate.",
        "sources": [
          {
            "url": "https://baxtel.com/data-center/quincy",
            "outlet": "Baxtel"
          },
          {
            "url": "https://www.yoursourceone.com/columbia_basin/report-quincy-at-center-of-debate-over-washington-s-data-centers-clean-energy-future/article_f2b12988-6708-44bd-b1fb-72e8a5e4d43b.html",
            "outlet": "Source ONE"
          },
          {
            "url": "https://www.dwt.com/blogs/energy--environmental-law-blog/2026/03/washington-legislature-delays-data-center-bill",
            "outlet": "Davis Wright Tremaine"
          }
        ]
      },
      {
        "topic": "pushback",
        "text": "Seattle's City Council advanced a data center moratorium, with key votes scheduled for early June 2026 after grassroots campaigning. Opponents also organized a protest at an AI expo in Wenatchee in 2026.",
        "sources": [
          {
            "url": "https://www.theurbanist.org/seattle-advances-data-center-moratorium-amid-public-backlash/",
            "outlet": "The Urbanist"
          },
          {
            "url": "https://www.yoursourceone.com/columbia_basin/protest-planned-at-wenatchee-ai-expo-over-data-centers/article_65691ae6-e598-4c69-8dba-d6b6b359b681.html",
            "outlet": "Source ONE"
          }
        ]
      },
      {
        "topic": "universities",
        "text": "The University of Washington launched AI@UW in February 2026, funded by a $10 million gift from Charles Simonyi in November 2025 and led by vice provost Noah Smith. The Allen School lists AI safety among its seven areas of AI work, and in September 2026 UW researchers including Franziska Roesner and Smith published a Q&A on AI risk.",
        "sources": [
          {
            "url": "https://www.dailyuw.com/article/uw-launches-ai-initiative-as-faculty-raises-concerns-purple-rollout-delayed-20260225",
            "outlet": "The Daily (UW)"
          },
          {
            "url": "https://www.washington.edu/news/2026/09/16/uw-researchers-discuss-ai-risk/",
            "outlet": "UW News"
          }
        ]
      },
      {
        "topic": "congress",
        "text": "Sen. Maria Cantwell (D), ranking member of Senate Commerce, led the July 2025 effort that removed a 10-year moratorium on state AI laws from the budget bill by a 99-1 vote. She later criticized the president's AI executive order for \"overly broad preemption\" that threatens states over protections against AI fraud, scams and deepfakes.",
        "sources": [
          {
            "url": "https://www.commerce.senate.gov/press/dem/release/ranking-member-cantwell-statement-on-trump-ai-executive-order/",
            "outlet": "Senate Commerce Committee"
          },
          {
            "url": "https://casrai.org/news/federal-ai-moratorium-state-preemption-fight-2026",
            "outlet": "CASRAI"
          }
        ]
      }
    ]
  },
  "review": {
    "status": "unreviewed",
    "note": "research pass, September 2026; not yet reviewed"
  }
}
